{"suite_version":1,"connector_id":"rutube","connector_version":"1.0.0","sdk_version":1,"passed":true,"checks":[{"id":"manifest_sdk","status":"pass"},{"id":"auth_boundary","status":"pass"},{"id":"health_normalization","status":"pass"},{"id":"normalized_errors","status":"pass"},{"id":"rate_limit_retry","status":"pass"},{"id":"idempotency","status":"pass"},{"id":"webhook_replay","status":"pass"},{"id":"tenant_isolation","status":"pass"},{"id":"dry_run_side_effect_suppression","status":"pass"},{"id":"production_credential_rejection","status":"pass"},{"id":"egress_grant_enforcement","status":"pass"},{"id":"resource_limit_failure","status":"pass"},{"id":"sandbox_isolation","status":"pass"}],"completed_at":"2026-08-12T01:20:00Z","report_sha256":"bc56983857c6872347f27f2111d564ee919069cdec99feef0e652bfbe055fc4f"}
