{"suite_version":1,"connector_id":"shopify","connector_version":"1.0.0","sdk_version":1,"passed":false,"checks":[{"id":"manifest_sdk","status":"pass"},{"id":"auth_boundary","status":"pass"},{"id":"health_normalization","status":"pass"},{"id":"normalized_errors","status":"pass"},{"id":"rate_limit_retry","status":"pass"},{"id":"idempotency","status":"pass"},{"id":"webhook_replay","status":"pass"},{"id":"tenant_isolation","status":"pass"},{"id":"dry_run_side_effect_suppression","status":"pass"},{"id":"production_credential_rejection","status":"pass"},{"id":"egress_grant_enforcement","status":"pass"},{"id":"resource_limit_failure","status":"pass"},{"id":"sandbox_isolation","status":"fail","reason_code":"isolation_probe_failed"}],"completed_at":"2026-08-28T07:31:40.334820374Z","report_sha256":"9889275e6342cb502a18a6f5fffc9572c8ae7f4a014bab83e19b06c38e4c705c"}
